{
  "schema_version": "1.0.0",
  "exchange_id": "AU-EX-20260725-003",
  "task_id": "AU-CDX-TASK-001-CLARIFICATION",
  "task_type": "PRODUCT_CLARIFICATION",
  "requested_claude_role": "Chief Project Orchestrator",
  "source_commit_sha": "e53794b51e0ed753e9d1b7b39ac455df23e4b5bf",
  "source_branch": "codex/task-thinslice-001-technical-review",
  "review_commit_range": "1319f4746565be9ed962b8150365e1abacf08fb7..e53794b51e0ed753e9d1b7b39ac455df23e4b5bf",
  "prepared_at": "2026-07-25T14:12:27Z",
  "prepared_by": "AU-CODEX-PRIMARY",
  "purpose": "Request product-authorized disposition of the TASK-THINSLICE-001 Technical Review clarifications after the bounded OQ-005 spike, while development remains blocked.",
  "scope": [
    "Review the exact TASK-THINSLICE-001 v1.0 Technical Review and OQ-005 spike evidence at source commit e53794b51e0ed753e9d1b7b39ac455df23e4b5bf.",
    "Disposition CLR-001: confirm whether product-source SXP is a typographical error for the officially documented XSP Cross Stitch Professional Platinum format, or identify the intended distinct SXP format with authoritative evidence.",
    "Disposition CLR-002: accept or reject the Codex recommendation of OXS 1.0 as the first Phase 0 structured importer under the owner-confirmed minimal parsing complexity while representative criterion.",
    "Disposition CLR-003: define the authorized route for repository fixtures, including redistribution and derivative permission for a small full-cross OXS pattern, a medium representative OXS pattern, and a corrupted negative-test derivative.",
    "If OXS is accepted or product terminology changes, return exact append-ready Product Decision Log and OQ-005 register text and identify whether TASK-THINSLICE-001 requires a new version.",
    "Preserve the separation between product clarification, Codex Technical Design authority, AU-AGENT-002 documentation lifecycle, AU-AGENT-003 later independent engineering verification, and Claude independent product acceptance."
  ],
  "out_of_scope": [
    "Editing the canonical repository, product sources, engineering review documents, code, fixtures, dependencies, infrastructure, Cloudflare, GitHub, CI/CD, or deployment.",
    "Designing or implementing the importer, canonical Pattern schema, renderer, client, persistence, security limits, performance budgets, pipeline, or rollback.",
    "Approving a Technical Design, ADR, implementation, release, or project VERIFIED status.",
    "Inventing a format, license, rights grant, fixture content, product behavior, UX, scope, priority, or acceptance criterion.",
    "Treating publicly downloadable vendor samples as redistribution-authorized without explicit evidence.",
    "Starting development or authorizing Codex to bypass the Technical Design and architecture-review gates."
  ],
  "required_inputs": [
    "sources/review/review-range.diff",
    "sources/review/review-range.stat.txt",
    "sources/review/review-range.commits.txt",
    "sources/repository/docs/reviews/technical/TASK-THINSLICE-001/TECHNICAL_REVIEW.md",
    "sources/repository/docs/reviews/technical/TASK-THINSLICE-001/OQ-005_IMPORT_FORMAT_SPIKE.md",
    "sources/repository/docs/reviews/technical/TASK-THINSLICE-001/CLARIFICATION_AND_CONFLICT_REPORT.md",
    "sources/repository/product/task-packages/07_TaskPackage_EP01_ThinSlice.md",
    "sources/repository/product/decisions/05_Decision_Log.md",
    "sources/repository/product/architecture-inputs/02_Architecture_and_Stack.md",
    "sources/repository/docs/OPEN_QUESTIONS.md",
    "sources/repository/docs/TASKS.md",
    "sources/repository/docs/CURRENT_STATUS.md",
    "sources/repository/.codex/CURRENT_FOCUS.md",
    "sources/repository/docs/SOURCE_OF_TRUTH.md",
    "sources/repository/collaboration/README.md"
  ],
  "included_files": [
    {
      "path": "sources/repository/.codex/CURRENT_FOCUS.md",
      "sha256": "923ac44bd12cec50b285121f7f54c28881e71e453e4ce801b8352b50ab4f415e",
      "size_bytes": 2590
    },
    {
      "path": "sources/repository/AGENTS.md",
      "sha256": "048082169d2426370da4195fd8a05bb65841ef2264634180b5cabf616659af80",
      "size_bytes": 15872
    },
    {
      "path": "sources/repository/collaboration/README.md",
      "sha256": "cf4c8f51692d3b534e671b9d378f72b3d14d9eb4ceecbb5f0e3c766c88fc3ecf",
      "size_bytes": 5427
    },
    {
      "path": "sources/repository/collaboration/schemas/README.md",
      "sha256": "626a48d22310c43951b1a96401cc504e49cc8bc86391a823e8792974804604a1",
      "size_bytes": 2073
    },
    {
      "path": "sources/repository/collaboration/schemas/claude-return-manifest.schema.json",
      "sha256": "a0e009fe57a117c6da9d5b1af8d139ef30df6f0dacac70e3659a3eb62d4425cc",
      "size_bytes": 3542
    },
    {
      "path": "sources/repository/collaboration/schemas/claude-task-manifest.schema.json",
      "sha256": "cbccb9d25d2240b0bbb3609b79b908aa53c5b392a8c73dafe579e59e5ddbf070",
      "size_bytes": 4451
    },
    {
      "path": "sources/repository/docs/CURRENT_STATUS.md",
      "sha256": "872c27ee1d555fdc48dacbf3a36b85dc557a2bd6d86493c90bc839a1c8a2e018",
      "size_bytes": 16619
    },
    {
      "path": "sources/repository/docs/HANDOFF_LOG.md",
      "sha256": "002f36983393ccbc361ef7a6e0835fda4e1a23a09c288b5e09066fe4905bb950",
      "size_bytes": 38313
    },
    {
      "path": "sources/repository/docs/OPEN_QUESTIONS.md",
      "sha256": "c8e8009d776a4ac103e12e9e505f9f59ee4c86569a44ab0e1f7e347d0fa6a728",
      "size_bytes": 3979
    },
    {
      "path": "sources/repository/docs/RISKS.md",
      "sha256": "3c8dc0da3a7214ae096948ef9cca16df88322cc84541115fa8aeb449fa4adf0e",
      "size_bytes": 13748
    },
    {
      "path": "sources/repository/docs/SHARED_WORKFLOW.md",
      "sha256": "39d2355645b3e8a0e235ec0689c0f139f63e4b5b4b46b9c5bc2a2649edf3635b",
      "size_bytes": 5692
    },
    {
      "path": "sources/repository/docs/SOURCE_OF_TRUTH.md",
      "sha256": "2390a42ecdef1629469d43e12254993daadc91c7aa6b05ab65d07b346c54c39d",
      "size_bytes": 12050
    },
    {
      "path": "sources/repository/docs/TASKS.md",
      "sha256": "040ba6396c6523b67ab74c70e5a6e1f33937d511ad90ee28e21cf14a2f8b9bc5",
      "size_bytes": 22089
    },
    {
      "path": "sources/repository/docs/TRACEABILITY_MATRIX.md",
      "sha256": "8c27e3e748485d035fa11872757e85c70e05eb156ec2ec1c3c58c5200fead7f2",
      "size_bytes": 11563
    },
    {
      "path": "sources/repository/docs/reviews/technical/README.md",
      "sha256": "8e1591e6a632ed42700ad8986b7b496917f9130491ad35964bf2b588285f4e4a",
      "size_bytes": 2448
    },
    {
      "path": "sources/repository/docs/reviews/technical/TASK-THINSLICE-001/CLARIFICATION_AND_CONFLICT_REPORT.md",
      "sha256": "8d3eaecddabc9fff9533747ecddbf57d6aa186f13d362fb5a5e1add92983f53a",
      "size_bytes": 4025
    },
    {
      "path": "sources/repository/docs/reviews/technical/TASK-THINSLICE-001/OQ-005_IMPORT_FORMAT_SPIKE.md",
      "sha256": "721908832d6ada092566c5c2113b43a1bf77e5f24399536cc0b226c01efe0a9f",
      "size_bytes": 8247
    },
    {
      "path": "sources/repository/docs/reviews/technical/TASK-THINSLICE-001/README.md",
      "sha256": "dd1a6d1e9efc53f2775c9dee6944008a37c52e5c9dea7f6d0ad611b0ac42beea",
      "size_bytes": 2819
    },
    {
      "path": "sources/repository/docs/reviews/technical/TASK-THINSLICE-001/TECHNICAL_REVIEW.md",
      "sha256": "e82f5388d14efb87ca174ac2a1e526b8f292b73f3a90ac587db61ca8e82678f3",
      "size_bytes": 17303
    },
    {
      "path": "sources/repository/product/README.md",
      "sha256": "c32e54b71d415ca6d20f66a20e3e266b6a6a83b7664c784e47cab8b5b5739658",
      "size_bytes": 5606
    },
    {
      "path": "sources/repository/product/architecture-inputs/02_Architecture_and_Stack.md",
      "sha256": "eaeab3608b0b4ed9a67c99152eabf9b4a91dad6e933e7b45e0cb2d73b26a321a",
      "size_bytes": 26015
    },
    {
      "path": "sources/repository/product/decisions/05_Decision_Log.md",
      "sha256": "b71c888e9153029b61db50e2af6eae3c37cd0944573a10cb46637508d19d9563",
      "size_bytes": 30530
    },
    {
      "path": "sources/repository/product/governance/04_Codex_Context_Pack.md",
      "sha256": "ad6c9e23ed82a6a1da22b1e964ec88e73e7f8fb34d3345249da19ee21287dcb9",
      "size_bytes": 25471
    },
    {
      "path": "sources/repository/product/governance/CLAUDE_COWORK_PROJECT_INSTRUCTIONS.md",
      "sha256": "299c70eca5cd80983310767afccc7a52669f040818298de92464f4edfca2bd72",
      "size_bytes": 11466
    },
    {
      "path": "sources/repository/product/task-packages/07_TaskPackage_EP01_ThinSlice.md",
      "sha256": "89971954aac150cc8d116808797de5289886e7556247c75a1731d0324fddc8ae",
      "size_bytes": 45081
    },
    {
      "path": "sources/review/review-range.diff",
      "sha256": "a063035133dfc4e22ddb2f220ed956179b1cf38fc00f06095733fd3488a50a0f",
      "size_bytes": 56732
    },
    {
      "path": "sources/review/review-range.stat.txt",
      "sha256": "5817e72edc9dbf5b8e9d48b0b47695f9dc753861d9008cb8a5a329f141135da0",
      "size_bytes": 1003
    },
    {
      "path": "sources/review/review-range.commits.txt",
      "sha256": "2027fdc582f531e4b58fab0f6d89e78c23320c1c930a32bf0403da539c315ceb",
      "size_bytes": 78
    }
  ],
  "expected_outputs": [
    "return-manifest.json conforming to the registered return schema with result_type PRODUCT_CLARIFICATION.",
    "outputs/task-thinslice-001-clarification-response.md containing explicit dispositions for CLR-001 through CLR-003, exact product-source integration text where authorized, authority provenance, limitations, open questions, and the next gate."
  ],
  "acceptance_criteria": [
    "The response reviews the exact Technical Review, spike, Conflict Report, Task Package, and product decisions registered by checksum.",
    "CLR-001 is answered explicitly: SXP is confirmed as XSP, or a distinct SXP format is identified with authoritative specification and representative-file evidence.",